Gerçeğin mayası gözle görülmez, yürekle bakmalı.
Güzel çağrı, duyabilene.
Her insanın içindeki, kiminde daha hissedilir kiminde derinlerdeki çocukluğu, masum cevheri anımsatan bir kitap
herkesin hayatına ufakta olsa bir dokunuş yapan bir eser.
Büyük küçük herkesin kitaplığında bulunması gereken, içimizdeki çocukla birlikte okuduğumuzda daha da keyif veren bir eser. Herkese tavsiye ederim.
"Sana ait olanı bu kadar önemli yapan,onun için harcadığın zamandır" Küçük Prens hem küçüklere hem de büyüyemiş küçüklerimize hitap ediyor.Kült bir eser.Tavsiye ederim.
Çocuk ya da büyük ol çok sevdiğim bir kitap zaman zaman tekrar tekrar okuyorum
Tek kelime ile bayıldımmm her yaştan insana öğüt veren düşündüren güzel bir baş ucu kitabı
Çok güzel herkese hitap edebilen bir kitap ..
Yediden yetmişe her yaşta okunabilecek nadir eserlerden birisi.
1 kez okudum fakat o bahsedilen kendine içkin derin anlamları çıkardığım söylenemez. Ama tekrarlayan okumalarda olacağına inanıyorum. O yüzden tekrar okumaya devam
Herkes okumalı yaşım geçti demeyin kaç kere okuduğumu hatırlamıyorum mutlaka okuyun.
küçük prens ya ne yorum yapilabilir ki ♡ ama can çocuk yayınlarından almanizi tavsiye ederim çevirinin kalitesini önemseyenler için iyi bir seçenek
Bir klasik ve buyuk kucuk demeden her yas doneminde farkli duygular hissettiren sihirli bir kitap.
Daha önce okumuştum şimdi de kızım için aldım.
çocukluğunda okumamış olanlar kendi çocuklarıyla birlikte okusunlar.öyle saf öyle temiz..
Beğendim güzel kitap fakat bazı yerlerde anlam veremedim
Hep abartıldığını düşündüğüm bir kitap olduğunu düşünmüşümdür. Ancak kızım da okuyup fikir sahibi olmak istediği için aldım.
Çok güzeldi. Okuyun okutturun. Tekrar tekrar okuyun..
Her yaştan insana hitap eden ve içinde mutlaka kendine ait bir şeyler bulacabileceğimiz bir kitap.
Her yaş grubuna hitap eden bir kitap. Yetişkin, çocuk herkes okuyabilir. Özellikle çocuklar için hayal gücünü geliştirecek bir başucu kitabı.
Tüm yaşların okuması ve ders alması gereken bir eser.
hala okumayan varsa hiç düşünmeden alıp okumalı hem de defalarca.
Her yaşa hitap eden düşündürücü bir kitap. cocuk sağlığı ve masumiyetiyle yazılmış.
Her okuduğumda çocuk gibi oluyorum. Defalarca okunabilecek ve okurken sıkılmayacağınız bir kitap.
Masalların en güzeli,tüm çocuklara okutulması lazım.
Her yaşta tekrar tekrar okunabilecek bir eser herkese tavsiye ederim
Sevdiğim her insana aldım bu kitabı.O kadar saf duygular içeriyor çok masumca
Küçük büyük herkesin kitaplığında olması gereken bir kitap. Çocukların okuma alışkanlığı kazanmasında büyük yere sahip.
Keşke çocukken okusaydım, Mutlu Prens'le karıştırdığım için okumadığımı sonradan farkettim. Büyükken okuyunca övüldüğü kadar tat alamadım ama tekrar okuyacağım, zamanla farklı bir bakış açısıyla okurum belki. Yine de çocuk kitabı olarak değerlendirilirse oldukça farklı bir kitap, okunmalı.
Mükemmel bir eser, ismi gibi kendide küçük ama insana kattıkları çok büyük.
Böyle güzel bir kitap yaşınız ne olursa olsun okumalısınız!
Yeğenime aldığım bir kitap çok beğendi çok güzel bir kitap
her yaas grubuna hitap eden basucu kitabi niteliginde
Asla bir çocuk kitabı değil, her yaş farklı anlamlar çıkarır bu kitaptan.
Başucunda kitabım ara ara açıp okurum.
Her sene en a 2 defa okuduğum bir kitaptır.Şiddetle okunmasını tavsiye ederim.
Kitaplığımın baş tacı oldu hep, çocukken de anneyken de.
Basitlik karmaşıklığın son noktasıdır sözünün kitap hali gibi.
Sevgili Küçük Prens bize saf düşünceyi, çocuk kalbini hatırlatıyor. Kendi kalbimizi...
küçük büyük herkes okumalı ve hayatını sorgulamalı müthiş bir eser.
her insanın okuması gereken bir eser
Kaliteli bir çeviriden okununca ekstra tat alınan eser.
her yaştan insan okuyabilir çok güzel mutlaka okuyun
çocuk kitabı olabilir ama en az çocuklar kadar yetişkinlerin de kitabı. insana hayatındaki birçok şeyi sorgulatan, yeniden düşünmeye sevk eden, hatta değişiminize sebep olabilecek bir eser.
Öğrencilerime okuttum okuyanların çoğu sevdi.
Her yaştan insanın çok sevip etkileneceği bir kitap. Özellikle "Ölene kadar zorunlusun gönül bağı kurduğun her şeyden" sözü çok anlamlıydı.
önceden okumama rağmen kitaplığımda olmaması büyük bir eksiklikti ve hemen sipariş verdim
Kaç defa okudum gerçekten bilmiyorum. Şimdi hediye etmek için almaya devam.
Her yaştan insanın okuyabileceği etkileyici bir kitap
Tam bir baş yapıt... yediden yetmişe okunmalı.
Küçükken sevmiştim şimdi de seviyorum yaşlanınca da seçeceğim
Bu kitap bir klasik...her çocuğun okuması gereken bir kitap
çocukken okumayı istediğim ama bi türlü okuyamadığım kitaptı. bana o yılları hatırlatacak
Dünyanın en çok okunan kitaplarından biri.Fazla söze gerek yok bence.Okuyun
İnsanın hayata bakışını değiştirebilecek harika bir kitap
Küçük Prens. Keşke gerçek olsa dediğim bir karakter. Mükemmel bir kitap.
Gerçekten etkili mesajlar veriyor.
Bayıldım çok iyi. Filmini de izlemiştim . Ama kitabı daha güzel tabi ilk başta anlaması biraz zor
her okunduğunda farklı şeyler katabilecek bir kitap
her yaş grubuna hitap ediyor. anlamlı ve özel bir kitap
Çok bebekçeydi, 9 ve altı için uygun 9 ve altı için güzel.
Herkes alıp okuyabilir benim düşünceme göre
çok satılan bir kitap olmayı fazlasıyla hak ediyor.
yazarın hayal dünyası gerçekten etkileyici.
çocuklardan ziyade erişkinlere hitap eden bir kitap olduğunu düşünüyorum
yıllar önce yazılmış defalarca baskı yapmis yüzlerce binlerce insan tarafından okunmuş bir kitap olduğundan herkesin kendi hayatına birşey olsa katacaktır diye düşünüyorum
Çok güzel bir kitap.İlkokul,ortaokul,lise hatta üniversite ve büyüklerde okuyabilir.Ben bu kitabı çok okudum ve çok beğendim.Bu kitabı almak isteyen herkeze tavsiye ederim.
Yediden yetmişe her yaşta okunabilecek nadir eserlerden
Bir Küçük Prens klasiği hayatı daha yaşanılabilir kılmak isteyenlere tavsiye
Dusunmeyi sevenleri bu kitaba davet ederim.
çok satılan bir kitap olmayı fazlasıyla hak ediyor.
yazarın hayal dünyası gerçekten etkileyici.
çocuklardan ziyade erişkinlere hitap eden bir kitap olduğunu düşünüyorum
Bu kitap üzerine yüzlerce eleştiri ve yorum yazıldı,hani ne yazsak azdır diyeceğimiz cinsten bir kitap.Hem ülkemizde hem Dünyada kabul görmüş bir klasik.Bu kadar az sayfaya bir o kadar çok şey sığan kaç kitap vardır acaba?Her paragrafta ayrı bir dünya ve her okunuşta yeni yeni anlamlar.Okuyun,okutturun efendim!
Dünyada en çok satılan kitaplardan biri. Bir çocuğun gözünden yetişkin dünyasının eleştirisi. Her yaştan okuyucunun okuyabildiği muhteşem bir eser.
Bir dünya klasiği söylemeye gerek yok
Barış Manço şarkıları gibi yediden yetmişe herkese hitap edebilen bir kitap
Büyük küçük farketmeden kalbi olan herkesin etkilenececeği bir kitaptı...
Çocuğuma aldım ama büyüklerinde okuyabileceği anlamlı bir eser.
Okumakta biraz geç kaldığım,
küçük büyük her yaştan bireyin okuması gereken düşündürücü şirin bir kitap önerilir ..
her yaştan herkesin yilda bir kez muhakkak okumasi gerekir
Küçükken okuduğum ve şimdi tekrar okuduğum bir eser tekrar okumak harikaydı
favori kitaplarımdan biri. beni düşündürmeyi ve güldürmeyi başarıyor.
1 SAATTE BİTİRDİM DEFALARCA OKUDUM ÇOK GÜZEL
Dünya klasiklerinden çok güzel bir kitap. Her insanın okuması lazım. Fiyatı da çok uygun. Kaçırmayın.
Küçük prensin kocaman dünyasını anlatan muazzam bazen sıkılıp elime alıp okuduğum ve her okuduğumda ilk kez okuyormusum hissini veren cokcukca ama kocaman bi dünya
Yaşınız kaç olursa olsun dönüp dönüp okuyabileceğiniz bir kitap.
yaş fark etmez mutlaka okunmalı
hep çok merak ettiğim bir kitap olmuştur. sonunda okuyabileceğim.
insan hayatının herhangi bir noktasında bu eseri mutlaka okumalı.
Kesinlikle okunmalı ama düşüne düşüne.
Sen ne kadar minnos bir kitaptiinn ve etkili
Herkes okumalı bunu fazla söze gerek yok
Standart sevgi kitabı her yerde her ortamda bulunur
Okuyun okutun. Özellikle çocuklarına kitap okumayı sevdirmek isteyenler bununla başlayabilirler.
herkes okumalı öyle ya da böyle
Ne kadar çocuk kitabı gibi görünsede büyüklerin okuması gereken bi kitap
Hayatın her dönemine hitap eden bir kitap , başucunda dursun.
Özellikle yetişkinlerin okumasnı salık veririm!
Tüm sınıfıma aldım. Her insanın mutlaka okuması gereken bir kitap. Çocuk kitabı gibi gözükmesine rağmen her yaştan bireyin farklı öğretiler edinebileceği bir başyapıt.
Her yaşta insan için okuması keyifli bir kitap.
Arkadaşıma hediye aldım sonrasında ben de okudum simyacıya benziyor
Küçük büyük herkesin okuması gerekiyor.
Asla sadece bir çocuk kitabı değil, hiç olmadı da
Okumayan kalmamıştır herhalde☺️
İlerde çocuğum olursa ona okuyacağım kitaplardan bir tanesi mutlaka.
her yaştan insanın düzenli olarak okuması gerekir
Hem cocuk hem yetiskin kitabi. Guzel bir kitap
çocuklar için iyi bir okuma kitabı. yetişkinlerin fazla abarttığı kanaatindeyim.
İngilizcesini de okudum, gerçekten rüya gibiydi
nedense kızım kıtabı okuduktan sonra anlatma kısmına geldıgınde aklında kalmadığını ve zorlandıgını söyledi,sevıye olarak erken mi acaba ??(2. sınıf)
her yaşın başucu kitabıdır
çocukluğumuzun baş ucu kitabını yıllar sonra yeniden okudum.
Sonra da çok sevdiğim bir arkadaşıma hediye ettim.
Herkesin kütüphanesinde 2 tane olması gereken bir eser. Bir adet size bir adet hediyelik :)
Bir solukta çocuk yetişkin herkes okusun derim
Efsane bir kitap. Herkes kendinden bir şeyler bulabilir.
Her yaştaki insan okuyabilir. Çocuk kitabı deyip geçmemek gerek
bence yetişkinlerin de okuması gereken bir kitap.
küçükler için gibi duruyor ama büyükler için de çok güzel mesajlar içeriyor, okunmalı
Herkese hitap eden bir kitap. Okunmalı.
Dünyaca çok okunup önerilmesi dolayısıyla okumuştum.Beğendiğim yerler olmakla birlikte sanırım beklentimi yüksek tutmamdan ötürü beni pek etkilemedi.
sadece cocuklar icin degil herkes okuyabilir zevkli ve guzel bir kitap
Herkesin çok sevdiği ve oglumun bayıldıgı bu kitabı sayesinde ben de begenerek okudm
Küçük prens en sevdiğim kitaptır. Bu kitabı yaklaşık 10 kere okumuşumdur. Etkisinden hiçbir zaman çıkamadığım en değerli kitabım küçük prenstir. Büyük küçük demeden herkesin okumasını şiddetle tavsiye ederim. Bu kitap kesinlikle bir çocuk kitabı değil. Küçükken büyükler yüzünden hayallerinden vazgeçmiş pilot bir adam ile büyüklerin ne kadar tuhaf olduğunu düşünen küçük prensin bir çölde karşılaşması ile kaleme alınan harika bir kitap herkese tavsiye ederim.
Kitap çocuklara hitap eden bir eser olmaktan ziyade daha çok felsefi ve derinliği olan değer taşımakta, ayrıca Cemal Süreya ve Tomris Uyar çevirisinden şaşmamalı.
Küçük prensin dönmesini o kadar bekledim ki. Bu zamana kadar okumadığım için kendime kızdığım çok güzel bir kitaptı
Yeğenlerim için aldım ama ben de okudum.Gayet güzel bir hikaye.
Küçük arkadaşlarıma hedıye alırken tek tercihim .
Kesinlikle bir çocuk kitabı değil, her kitapseverin kütüphanesinde olmalı
Çok iyi bir eser. Her kuşaktan insanlar için mutlaka okunmalı
Oğlum için almıştım, çok memnun kaldı.
Etrafınızdaki herkese, büyük küçük demeden okutulabilecek bir kitap.
H
Her yaştan insanın okuyabileceği bir kitap. Çok güzel.
Çocuklar için aldım, ben de okudum. akıcı bir hikaye.
çocuk kalmak isteyen büyükler için
Herkesin okuması gereken eser
Sıcak bir fincan kahve içmişsiniz gibi etki bırakan güzel bir kitap.
büyük küçük herkese bir şeyler katabilecek bir kitap
Çok sevimli çok güzel bir kitap. Düşünerek okumak gerek
Her yaşa hitap eden çok güzel bir kitap
Cemal süreya çevirisi oldukça güzel. Çocuk-genç okunabilir.
Yaş farketmez herkes okumalı bence.
gülünü önemli kılan ona harcadığın zamandır. gayet güzel bir kitap
Büyük küçük herkesin okuyabileceği. Ortak noktada bulusulacak bir eser
Büyük küçük herkesin okuması gereken bir kitap. Bazı sayfalarda insan ister istemez kendini sorguluyor.
Küçük prens içinizdeki çocuğa işliyor. İlk okuduğumda çok etkilenmiştim.
insanın bakış açısını değiştiren eserlerden biri
Bazı masallar vardır büyüklerin ders çıkarması gerektiği küçük prenste tamda onlardan biri
Bir kitap insanın hayatını değiştirir derler ya küçük prens aynı öyle bir kitap
Gerçeğin mayası gözle görülmez... okuyun mutlaka seveceksiniz
herkesin okumasi gereken bakış açısı değiştirecek bir kitap
popüler olup faydası da olan bir eser
Özellikle yetişkinler okumalı.
7den 70e herkes okumalı kütüphanesinde bulundurmalı.
Küçükler ve büyükler için de uygun ve okunması gereken bir kitap.
.. bir an gelir günışığına çıkmaya ihtiyaç duyan küçük prensi yüreğinizin derinliklerinde hisseder ve unutmuş olduğunuz anıları bu hikayeyi okudukça yeniden hatırlarsınız =))
Değerli bir eser ama popüler kültür ile fazla abartıldığını düşünüyorum.
Efsane klasik her kitaplıkta olmalı
tek nefeste biten bir kitap. kütüphanede bulundurmalı.
Her yas icin okunmasi gerkeen bir kitap
Küçük kuzenlerim için aldım. Bence her yaştan insanın okuması gereken bir kitap
Populer kültürün anlam veremediğim kitabı. Sadece emeğe saygı.
Her okuduğumda yeniden keşfettiğim ve ders kitabı olması gerektiğini düşündüğüm bir kitap. Küçük büyük herkes tekrar tekrar okumalı bence.
Kitap okuma alışkanlığımı yeniden kazanmama yardım eden en güzel eserlerden biri.
Yoğun ilgi üzerine aldım ama beni pek sarmadı. Güzel ama çocuklar için
Küçük, büyük herkesin (özellikle de büyüklerin) okuması gereken güzel bir eser. Tavsiye ederim.
Günümüz yetişkinlerini anlatan, her yaşta okunabilecek şahane bir kitap. Hayatı başka bir pencereden size yansıtıyor ve bir süre sonra hayatınızı sorgulamaya başlıyorsunuz.
Kitap ismi Küçük Prens fakat yüreği ve bilgeliği bizim kendimizi gördüğümüzden daha büyük.

Bir kitap düşünün, ismi duyulduğunda, resmini gördüğünde insanın yüzünde bir tebessüm, yüreğinde bir sıcaklık bırakıyor.

Bu kadar sevilmesinin altında çevirmenlerinin kendi aralarındaki sevgiyi de yansıtmış olma ihtimalleri de var.
Çocuk kitabı duruyor ama herkesin okuması lazım bence.
Her insan her yıl bir defa okumalı.
Daha önce başka yayından okuduğum bu eseri bir de can yayınlarından okumak istedim.gerek baskı kalitesi gerek çevirisi olsun çok güzel
Tekrar tekrar okumaktan keyif aldığım ve her okuduğumda yeni anlamlar yüklediğim kitap...
:)))) küçük prens... ismini hak ediyorr
Mesajlar çok güzel
İki sefer okudum ve daha sonra tekrar okuyacağım mükemmel bir kitap
Harika bir kitap. Herkes okumalı bence. Çocuklarında severek okuduğu bir kitap.
Çok kez belirtildiği gibi, sadece çocukların değil her yaştan okurun kendinden bir şey bulabileceği ve çok seveceği bir kitap. Hala okumayanlar varsa daha fazla geç kalmasınlar derim.
Efsane. Kaç kez okudum bilmiyorum. :)
Her yaşın kitabı. Bu kitabı yalnız bir defa okumak büyük kayıp olur. Tekrar tekrar okunmasını tavsiye ederim
Bu kitabı düşünmek beni hep mutlu etmiştir.
her yaştaki insanın okuyabileceği çok güzel bir kitap
2 minik kız öğrencim için aldım. Çok memnun kalmışlardı şimdi diğer öğrencilerime alıyorum mutlaka okuyun okutun
büyük küçük demeden herkes okumalı bu kitabı
Uygun fiyata güzel bir baskı olmuş, kitabı zaten bilmeyen yok:)
Herkesin içindeki çocuğa hitap edecek müthiş bir kitap kesinlikle çocuk kitabı değil
eskimeyecek bir kitap.
çok güzel anlamlar içeriyor!
dünya klasiklerinden daha çok 18 yaş üstü çocuklara hitabeden bir kitap. Ancak büyüklerin de azımsanmayacak derecede okuduğu bir klasik. tavsiye ederim, iyi okumalar.
Okuyun. Okutun. İmgesel anlatımla yeni bakış açıları ile değerlendirin, derim.
Her yaştan okurun okuması gereken bir kitap.
Okuyunca insanın bakış açısını değiştiren eserlerden
Küçük-büyük herkesin okumasını tavsiye ederim. Eskimeyen bir klasik.
Bazı eserler vardır okudukça güzelleşen, güzelleştikçe okunmak isteyen hayatınızın her evresinde başucunuzda olması gereken bir eser
Kac kez okuduk daha kac kez okuruz bilinmez Efsane
Her okuduğumda farklı anlamlar çıkardığım bir kitap, ilginç. Yeryüzünde bu kitabı okumamış kimse kalmamalı..
küçuk prens dünyası ayrı . Okuyun
Defalarca okunası bir başucu kitabı. Dili, çizimleri çocuk kitabı gibi görünse de felsefesi asla öyle değil. Her yaşta okunup tat alınacak bir eser.
Üzerinde düşünülmesi gereken etkili mesajlar veriyor. Her yaş grubunun okuması gereken - bilhassa büyüklerin - bir kitap.
farklı yaşlardaki insanların farklı mesajlar çıkarcağı bir kitap
Çocuk kitabı olarak tanınsada her yaştan mutlaka okuması gereken bir kitap tavsiye ederim.
Muhteşem bir hayal gücü... İçinde altını çizdiğim çok cümle oldu. Tvsiye ederim.
Tavsiye üzerine yeğenim için aldım sonrasında ben de okudum çok hoşuma gitti
En iyi çevirilerinden biri can çocukta
Çok güzel bir kitap daha öncede okumuştum herkes bir defa okusun isterim.....
İnsan ancak yüreğiyle baktığı zaman doğruyu görebilir
Her çocuğun ve yetişkinin okuması gereken müthiş bir hikaye.
Oğlumun doğum gününde arkadaşlarına küçük bir hediye.. En sevdiklerimizden.
sınıf kitaplıkları oluştururken aldığım ilk kitaplardan.
Tekrar tekrar okumak istediğim,başucumdan ayıramadığım bir kitap.
Üniversite yıllarımda okuduğum kitabı bir daha okumak için aldım.
Hem çocukların hem de yetişkinlerin yüreğine dokunabilen harika bir kitap. Kaç yaşında olursanız olun mutlaka okunması gereken bir eser.
Çocuk,genç ya da yetişkin olmanız fark etmiyor.Her yaştan insanın kendinden bir şeyler bulacağı müthiş bir kitap.
Dişer yayım evlerinden de aldım ancak bu beyaz kağıda olduğu için çocuklar daha çok beğendi.
Çocuklara ve hayalgücüne armağan edilmiş en büyük yapıtlardan biri
uzun zaman sonra yeniden okumak için aldım, insanda yarattığı duygu tarif edilemez. bence herkesin yılda bir kere okuması gereken bir kitap.
mükemmel bir kitap. kısa öz ama çocuk mutlaka okumalı. eğitim konusunda iz bırakıcı.
kitap söylendiği kadar var. çok severek okuduk. baş köşemizde
Aslında birçok yayınevi bastı bu kitabı. Ancak Tomris uyar çevirisi olması sebebiyle can yayınlarını terch ediyorum. Kitap üzerine söylenecek bir şey yok, okuyun okutun!
Söylenildiği kadar varmış. Her yaştan insanın okuyacağı bir kitap.
Sıcacık bir kitap. Her yaştan herkes okumalı.
bahsedildiği kadar güzel bir kitap.
Kuzenimin çocuğuna hediye aldım .
Alın ve herkese hediye edin o kadar güzel.
7'den 70'e herkesin okuyup ders çıkarması gereken bir kitap.
Ah ne iyi bir çocuksun sen küçük prens. iyi ki okudum seni beynimi de ruhumu da doyurdun.
kendim okumuştum, şimdi de hediye alıyorum, herkes okumalı diye düşünüyorum
Çocuklarımız için okutmamız gereken kitapların başında yer alır Küçük Prens
fazlasıyla öğretici bir çocuk kitabı
çocuklarınıza okuyacağınız haarika bir kitap
sıra dışı bir pilotun sıradışı bir hikayesi
her ne kadar çocuk kitabı olsada, okudukça ve büyüdükçe anlayacaksınız ki, kitap sizinle birlikte büyüyor. ve anlam kazanıyor.
Çocukların beğenerek okuduğu bireser
küçük büyük herkesin okuması gereken çocukların muhakkak ellerinden düşürülmemesi gereken bir baş yapıt
Basir bir alt metine sahip ama bu basitlik etkileyici bir şekilde sunulmuş.
Herkese okutmak istiyorum.
sadece çocuklar için değil 7 den 70 e herkese hitap ediyor
Herkesin kendine bir pay çıkarabileceği bir kitap.
Çocukların gözünden yetişkinlere harika dersler veren bir eser. Her yetişkin mutlaka okumalı.
Yoruma gerek yok. Harika
Herhangi bir yaş kategorisi olmadan zevkle okunabilecek bir kitap
Her yasa uygun herkes için yazılmıs bir kitap
Çocukların düşsel düşünce zenginliğini farklı bakış açısıyla aktarmış
her yaş grubuna hitab ediyor.. okunmasi gereken ve ders alınması gereken bir kitap
Herkesin mutlaka okuması ve o ders alması gereken bir kitap.
Eğer yoğunlaşmadan okunulursa anlaması güç olacaktır bence. Görüneni ve anlatılmak isteneni detaylı bir şekilde anlamaya çalışmalı.
Hayal dünyası geniş herkesin her yaşta okuması gereken bi kitap bence.
Küçük büyük demeden okunabilecek hoş bir kitap. Ama abartıldığı kadar olduğunu sanmıyorum
Bilinçli okumayla çok şey edineceksiniz
Her yaştan insanın okuması gereken bir kitap.Kesinlikle anlıyarak okumak gerekiyor.
Ah Küçük Prens!Daha önce neden okumamışım dediğim bir kitap oldu.Çokca güzel cümleler barındırıyor.
Oğlumun doğum gününde hediye olarak dağıttım. Ahh küçük prens çok güzel bi kitapsın.
Hayal dünyası geniş herkesin her yaşta okuması gereken bi kitap bence
ÇOCUKLAR VE HALA ÇOCUK KALANLAR İÇİN GÜZEL BİR KİTAP.
herkes himayesine bişyler ekler, bende göküyüne sahip çıkayım ona sahip çıkan olmadı
eğitici bir kitap mutlaka çocuklarınıza ve öğrencilerinize okutunuz
Herkesin kendisine bir yerden ders çıkarabileceği bir kitap çok keyifle okudum
mükemmel bir kitap büyük küçük demeden herkesin okuması gereken bir kitap
İçimizi okuyor sanki Küçük Prens
Çocuk kitabı diyerek burun kıvırılmaması gereken, aksine okurken içinizin ısınacağı bir kitaptır. Birkaç yılda bir tekrar okunmalı, diyeceğimiz türde bir kitap, ki bunu kolaylıkla yapabileceksiniz; çünkü malum basit bir üslubu var. :)
Her sene bıkmadan usanmadan yeniden okuduğum nadir kitaplardan biri
Genç yetişkin herkesin kesinliklee okuması gerekir
Çocuklar kadar büyüklerin de sıkılmadan okuyacağı bir kitap
son 7 yıldır senede 1 kez okuduğum ve her okumamda aynı duyguyu yaşadığım ve farklı şeyler fark ettiğim kitap. bu sefer 9. sınıf öğrencilerim için alıyorum eminim onlar da çok sevecekler :)
Hem çocuklar hem de yetişkinler için güzel kitap.
Neden çok tuttuğunu ve sattığını hala anlam veremediğim, okuduğum kitap. Benim beklentimin çok altında kaldı.
En çok satanlarda yer alan bilmem kaç dile çevrilerek dikkat çeken değişik bir masal kitabı
kardeşime hediye aldım bu yaşlanmayan efsaneyi
Baskı kalitesi çok iyi, hediye etmek için neredeyse her yaşa uygun bir kitap diye düşünüyorum.
okuyunca aslında hayata çok karmaşık baktığımı anladım
Severek ve beğenerek okudu çocuklarım.
kızıma aldığım ilk kitap :) ileride keyifle okuyacağını umuyorum
her yaşta tekrar tekrar okunması gereken muhteşem bir kitap..
Dünyanın en tatlı ve değerli kitaplarından biri. Tatlı, naif, küçük prens.
birkaç yıl önce okumuştum bu yıl da on yaşındaki kardeşime okuttum. her yaşta başka bir şey öğreten harika bir eser.
Okula bağış için almıştım güzel kitap
Animasyon filmini de yaptılar ama mutlaka kitabı okunmalı.
ÇOK FAZLA RAĞBET GÖRSE DE HEMEN HEMEN HERKESİN BAŞUCU KİTABI OLSA DA BENİM BEKLENTİMİ KARŞILAMADI AÇIKÇASI.
Her yaştan insanın okuyabileceği bir kitap,okuyun okutun.Şiddetle tavsiye ediyorum. :)
Çocuk kitabı denilmeden okunması gereken bir kitap.
Küçük Prens için fazla bir şeye söylemeye gerek yok bence.
Mükemmel!
Sadece çocuklara değil yetişkinlere de seslenen bir kitap. Küçük kardeşim için aldıysam da benim de ilgimi çekti.
yıllarca okumak için erteledim ama iyi ki ertelemişim. çok güzeldi.
Tabi ki her çocuğun ve aynı zamanda her yetişkinin okuması gereken bir kitap. Sevmek, sahiplenmek, sorumluluk gibi konularda hayata bir çocuk gözüyle bakabilmeyi öğreten, bir çocuğun hayata hangi gözle baktığını gösteren keyifli bir eser.
Bana hediye edilen ilk kitaplardan biri, çocukken okumuştum ve başucu kitabım olmuştu..Kitaplığımın gözdesi..
“Gerçeğin mayası gözle görülmez.”.müthiş
kitabı okuyalı günler oldu, halen ara ara bazı bölümler farklı zamanlarda aklıma geliyor. gülümsetiyor. etkisi uzun süre devam edecek gibi. etkisini yitirirse tekrar okumayı düşünüyorum :) çok güzel, her kütüphanede yer alması gereken bi kitap
Bir değil;on ,yirmi,otuz kez okunabilecek baş ucu kitabı. iyi ki varsın küçük prens :)
Hem büyüklerin hem de küçüklerin okuması gereken bir klasik. En başarılı bulduğum çevirisi de budur.
Büyük bir nasihatname
Bir çocuğun gözünden dünya ya bakmak,olağanüstüydü.
Kitaplığın demirbaşlarındandır kendileri...
Tekrar tekrar okurum.Alti çizili cümlelerim var,bazen açar sadece onları okurum.Can Yayınlarınin çevirisi süper...
Tekrar tekrar okuyup, her defasında farklı bir haz almak.
'Yaşam, bize bütün kitapların öğrettiğinden daha çoğunu öğretir. Çünkü yaşam, bize karşı direnir. İnsan ancak engellerle karşılaşıp onları aşmaya çatıştıkça kendini tanımlar' der yazar. Tüm yaştaki insanların okuması için tavsiye ediyorum. Soluksuz bitireceğiz bir hikaye.
Çocuk kitabı gibi görülse de değil yetişkinlere yönelik bir kitap olduğunu düşünüyorum...
Abartilmaya değer bir kitap
